reviewId,userName,content,score,thumbsUpCount,reviewCreatedVersion,replyContent,appVersion,date,avod_end
ca2b4c22-b70d-4c86-918b-add1584d074a,수윈,다운로드 해서 오프라인으로 볼려고 했는데 자꾸 에피소드를 불러오는데 실패했다네요ㅠㅠ 다시켜보기도 하고 지웠다가도 깔았는데 해결방법없나요?,3,1,,"안녕하세요, 라프텔입니다. 이용에 불편을 드려 죄송합니다. 오프라인 재생 오류가 수정된 버전이 이미 배포되었습니다. 기기에서 라프텔 앱을 열고 3분 이상 충분히 기다리신 후에 앱을 종료하고 다시 시작하면 자동 업데이트됩니다. 이후 보관함 - 다운로드에서 만료된 에피소드가 있는지 확인해 주세요. 만약 있다면, 온라인 상태에서 자동으로 갱신됩니다. 여전히 재생되지 않으면 해당 에피소드를 삭제 후 다시 다운로드해 주시기 바랍니다. 앞으로도 안정적인 서비스 제공을 위해 최선을 다하겠습니다. 감사합니다.",,2024-09-17 09:36:26,before
cd3d2e83-c90b-4cdb-8dd1-d9beb1f6237c,송승하,다운받아서. 비행기에서 보려는데. 이런...영상이. 안되요 오류뜨고. 에피소드를 불러오는데실패. ... 에러코드 io. 네트워크 커넥트 페일 ㅡㅡ,3,1,3.57.0,"안녕하세요, 라프텔입니다. 이용에 불편을 드려 죄송합니다. 오프라인 재생 오류가 수정된 버전이 이미 배포되었습니다. 기기에서 라프텔 앱을 열고 3분 이상 충분히 기다리신 후에 앱을 종료하고 다시 시작하면 자동 업데이트됩니다. 이후 보관함 - 다운로드에서 만료된 에피소드가 있는지 확인해 주세요. 만약 있다면, 온라인 상태에서 자동으로 갱신됩니다. 여전히 재생되지 않으면 해당 에피소드를 삭제 후 다시 다운로드해 주시기 바랍니다. 앞으로도 안정적인 서비스 제공을 위해 최선을 다하겠습니다. 감사합니다.",3.57.0,2024-09-17 02:47:06,before
3fc5e109-43d6-4a31-bbff-dd40009cfed5,핑키,다운로드한 작품을 못보게하네; 언제 고치노?,2,1,3.57.0,"안녕하세요, 라프텔입니다. 이용에 불편을 드려 죄송합니다. 오프라인 재생 오류가 수정된 버전이 이미 배포되었습니다. 기기에서 라프텔 앱을 열고 3분 이상 충분히 기다리신 후에 앱을 종료하고 다시 시작하면 자동 업데이트됩니다. 이후 보관함 - 다운로드에서 만료된 에피소드가 있는지 확인해 주세요. 만약 있다면, 온라인 상태에서 자동으로 갱신됩니다. 여전히 재생되지 않으면 해당 에피소드를 삭제 후 다시 다운로드해 주시기 바랍니다. 앞으로도 안정적인 서비스 제공을 위해 최선을 다하겠습니다. 감사합니다.",3.57.0,2024-09-17 01:46:22,before
8c6007d2-65f1-4aa0-9190-e06f0c73e3ce,김서현,너무너무 잘 사용하고있었는데 오프라인으로 영상보려고 영상 다운로드를 했는데 앱 삭제 및 재부팅 했음에도 불구하고 에피소드를 재생할수없다며 에러코드가 뜹니다ㅜㅜ,5,0,3.57.0,"안녕하세요, 라프텔입니다. 이용에 불편을 드려 죄송합니다. 오프라인 재생 오류가 수정된 버전이 이미 배포되었습니다. 기기에서 라프텔 앱을 열고 3분 이상 충분히 기다리신 후에 앱을 종료하고 다시 시작하면 자동 업데이트됩니다. 이후 보관함 - 다운로드에서 만료된 에피소드가 있는지 확인해 주세요. 만약 있다면, 온라인 상태에서 자동으로 갱신됩니다. 여전히 재생되지 않으면 해당 에피소드를 삭제 후 다시 다운로드해 주시기 바랍니다. 앞으로도 안정적인 서비스 제공을 위해 최선을 다하겠습니다. 감사합니다.",3.57.0,2024-09-17 01:11:11,before
be8fe432-ca3c-493a-9f4b-528e2dd9d342,흔들꽁,잼나고 빠르게 올라와요,5,0,3.57.0,안녕하세요. 라프텔입니다. 고객님께서 만족하셨다니 저희도 기쁘고 보람을 느낍니다. 앞으로도 더 나은 서비스를 제공하기 위해 최선을 다하겠습니다.,3.57.0,2024-09-16 21:44:30,before
9e72f43e-5fd0-42fc-be56-7f63d609662e,Youngjun Choi,다운로드 영상이 인터넷이 연결 안돼있으면 재생 안되는 이유가 뭔가요? 다운로드는 인터넷 안될때 쓸려고 하는건데 다운 받은 영상이 인터넷 연결 안돼있다고 재생 안됨. exoplaybackexception error code io network connection failed 라고 하면서 재생이 안되는데 모바일은 되는데 태블릿만 안됨. 왜 그런가요?,1,11,3.57.0,"안녕하세요, 라프텔입니다. 이용에 불편을 드려 죄송합니다. 오프라인 재생 오류가 수정된 버전이 이미 배포되었습니다. 기기에서 라프텔 앱을 열고 3분 이상 충분히 기다리신 후에 앱을 종료하고 다시 시작하면 자동 업데이트됩니다. 이후 보관함 - 다운로드에서 만료된 에피소드가 있는지 확인해 주세요. 만약 있다면, 온라인 상태에서 자동으로 갱신됩니다. 여전히 재생되지 않으면 해당 에피소드를 삭제 후 다시 다운로드해 주시기 바랍니다. 앞으로도 안정적인 서비스 제공을 위해 최선을 다하겠습니다. 감사합니다.",3.57.0,2024-09-16 14:28:17,before
8d875b8f-1c1b-4da4-b4ba-a756cf452b16,적야,오프라인 저장했는데 재생이 안됩니다,1,4,3.57.0,"안녕하세요, 라프텔입니다. 이용에 불편을 드려 죄송합니다. 오프라인 재생 오류가 수정된 버전이 이미 배포되었습니다. 기기에서 라프텔 앱을 열고 3분 이상 충분히 기다리신 후에 앱을 종료하고 다시 시작하면 자동 업데이트됩니다. 이후 보관함 - 다운로드에서 만료된 에피소드가 있는지 확인해 주세요. 만약 있다면, 온라인 상태에서 자동으로 갱신됩니다. 여전히 재생되지 않으면 해당 에피소드를 삭제 후 다시 다운로드해 주시기 바랍니다. 앞으로도 안정적인 서비스 제공을 위해 최선을 다하겠습니다. 감사합니다.",3.57.0,2024-09-16 05:11:39,before
9d8b41fe-3315-4dc9-b95e-7c7a67d10480,박우진내꺼,넘 좋아요 😄,5,0,3.51.0,안녕하세요. 라프텔입니다. 고객님의 소중한 리뷰에 감사드립니다! 라프텔에 만족하셨다니 정말 기쁩니다. 고객님의 만족은 저희에게 큰 힘이 됩니다. 앞으로도 지속적으로 더 나은 서비스를 제공하기 위해 최선을 다하겠습니다.,3.51.0,2024-09-16 03:11:35,before
a7f13281-d475-429a-876d-bd5d46495c0e,이진광,최고의앱입니다,5,0,3.57.0,안녕하세요. 라프텔입니다. 고객님의 소중한 리뷰에 감사드립니다! 라프텔에 만족하셨다니 정말 기쁩니다. 고객님의 만족은 저희에게 큰 힘이 됩니다. 앞으로도 지속적으로 더 나은 서비스를 제공하기 위해 최선을 다하겠습니다.,3.57.0,2024-09-16 01:04:08,before
fa2be00f-7831-49bb-b678-291f6f3e74e2,정다연,꼭꼭꼭꼭 깔아.,5,0,3.57.0,안녕하세요. 라프텔입니다. 고객님의 소중한 리뷰에 감사드립니다! 라프텔에 만족하셨다니 정말 기쁩니다. 고객님의 만족은 저희에게 큰 힘이 됩니다. 앞으로도 지속적으로 더 나은 서비스를 제공하기 위해 최선을 다하겠습니다.,3.57.0,2024-09-16 00:58:40,before
44c1241d-8614-4085-9d34-43e0dc059a4d,겜플,와 애피소드 구매 있는거 짜증나긴 한데 좋긴해서 5점,5,0,,안녕하세요. 라프텔입니다. 고객님께서 만족하셨다니 저희도 기쁘고 보람을 느낍니다. 앞으로도 더 나은 서비스를 제공하기 위해 최선을 다하겠습니다.,,2024-09-15 11:59:56,before
a1fbaecc-3c3e-40de-a454-8dd5b34664c1,유광,다운로드 오류 고쳤다면서 왜 재생이 안돼요? 이제 다른 ott에서도 애니 대부분 볼 수 있는데 서비스까지 이딴식이면 라프텔 쓸 이유 없겠네요,1,2,,"안녕하세요, 라프텔입니다. 이용에 불편을 드려 죄송합니다. 오프라인 재생 오류가 수정된 버전이 이미 배포되었습니다. 기기에서 라프텔 앱을 열고 3분 이상 충분히 기다리신 후에 앱을 종료하고 다시 시작하면 자동 업데이트됩니다. 이후 보관함 - 다운로드에서 만료된 에피소드가 있는지 확인해 주세요. 만약 있다면, 온라인 상태에서 자동으로 갱신됩니다. 여전히 재생되지 않으면 해당 에피소드를 삭제 후 다시 다운로드해 주시기 바랍니다. 앞으로도 안정적인 서비스 제공을 위해 최선을 다하겠습니다. 감사합니다.",,2024-09-15 08:21:39,before
9ed7f21f-1111-47bd-9320-a6130ed4f2b8,nyanyanyan,없는것도 많고 그나마 들어오는것도 검열판인 경우도 많고 그래도 해결되지 않을까 싶어 응원삼아 안써도 몇달동안 맴버십 유지는 해놨지만 별 의미 없는거 같네요. 맴버십 혜택이 메리트가 이제는 전혀라고 해도 좋을만큼 없는 느낌이라 어차피 없는거 따로 찾아야 하면 그냥 다른데서 보는게 나을듯합니다.,1,7,3.57.0,"안녕하세요, 라프텔입니다. 라프텔은 합법적으로 국내 판권 계약을 기반으로 콘텐츠를 제공하고 있으며, 모든 콘텐츠는 방송법과 영화 및 비디오물의 진흥에 관한 법률을 준수합니다. 방송통신심의위원회 또는 영상물등급위원회에서 결정한 관람 등급이 매겨지고 심의를 거친 후 제공됩니다. 너그럽게 이해해 주시기 바랍니다.",3.57.0,2024-09-15 04:52:47,before
e29bbe55-34e0-468d-b5e5-4666b80bc0f3,오윤성,시간이 안되서 못보던 작품을 볼수 있어서 좋음,5,0,3.57.0,안녕하세요. 라프텔입니다. 고객님의 소중한 리뷰에 감사드립니다! 라프텔에 만족하셨다니 정말 기쁩니다. 고객님의 만족은 저희에게 큰 힘이 됩니다. 앞으로도 지속적으로 더 나은 서비스를 제공하기 위해 최선을 다하겠습니다.,3.57.0,2024-09-15 00:45:55,before
d51984d0-9a88-4652-901d-11fac70479af,문의찬,다운로드 하고 오프라인에서 재생하는데 네트워크 연결 안해도 재생가능한걸로 아는데 재생이 안됩니다,1,2,3.57.0,"안녕하세요, 라프텔입니다. 이용에 불편을 드려 죄송합니다. 오프라인 재생 오류가 수정된 버전이 이미 배포되었습니다. 기기에서 라프텔 앱을 열고 3분 이상 충분히 기다리신 후에 앱을 종료하고 다시 시작하면 자동 업데이트됩니다. 이후 보관함 - 다운로드에서 만료된 에피소드가 있는지 확인해 주세요. 만약 있다면, 온라인 상태에서 자동으로 갱신됩니다. 여전히 재생되지 않으면 해당 에피소드를 삭제 후 다시 다운로드해 주시기 바랍니다. 앞으로도 안정적인 서비스 제공을 위해 최선을 다하겠습니다. 감사합니다.",3.57.0,2024-09-14 22:38:41,before
92b826a2-82d1-4668-9b28-5d054a5ed57f,독점화,애니가 부족해,4,0,3.57.0,"안녕하세요. 라프텔입니다. 라프텔은 애니메이션 전문 스트리밍 서비스로써 더 많은 작품을 확보하고, 고객님께서 원하는 콘텐츠를 제공할 수 있도록 지속적으로 노력하고 있습니다. 앞으로도 고객님의 기대에 부응하기 위해 최선을 다하겠습니다. 소중한 의견 주셔서 감사합니다.",3.57.0,2024-09-14 21:49:53,before
438c35c4-694a-44ff-80e2-3511d437ec15,IRU,아직 UX는 이런저런 개선의 여지가 있어보이지만 애니메이션 팬 입장에선 최고의 OTT라는 점은 인정합니다.,5,0,3.57.0,안녕하세요. 라프텔입니다. 고객님의 소중한 리뷰에 감사드립니다! 라프텔에 만족하셨다니 정말 기쁩니다. 고객님의 만족은 저희에게 큰 힘이 됩니다. 앞으로도 지속적으로 더 나은 서비스를 제공하기 위해 최선을 다하겠습니다.,3.57.0,2024-09-14 15:46:43,before
740e28f6-2187-4df0-b5e6-91ab5c24f054,귀먹은홍시,다 좋은데 다운로드한 애니가 재생이 안돼여,5,0,3.57.0,"안녕하세요, 라프텔입니다. 이용에 불편을 드려 죄송합니다. 오프라인 재생 오류가 수정된 버전이 이미 배포되었습니다. 기기에서 라프텔 앱을 열고 3분 이상 충분히 기다리신 후에 앱을 종료하고 다시 시작하면 자동 업데이트됩니다. 이후 보관함 - 다운로드에서 만료된 에피소드가 있는지 확인해 주세요. 만약 있다면, 온라인 상태에서 자동으로 갱신됩니다. 여전히 재생되지 않으면 해당 에피소드를 삭제 후 다시 다운로드해 주시기 바랍니다. 앞으로도 안정적인 서비스 제공을 위해 최선을 다하겠습니다. 감사합니다.",3.57.0,2024-09-14 14:04:37,before
c368c29c-7324-4e47-8b57-9c7780f315ef,김유리,짱,5,0,3.56.0,안녕하세요. 라프텔입니다. 고객님께서 만족하셨다니 저희도 기쁘고 보람을 느낍니다. 앞으로도 더 나은 서비스를 제공하기 위해 최선을 다하겠습니다.,3.56.0,2024-09-14 12:00:23,before
1027ba93-336d-4599-b173-5cedff01f54a,김지민,처음부터 끝까지 만족스러운데 줄거리 스킵 그게 없어서 쫌 아쉽네요,5,0,3.57.0,"안녕하세요. 라프텔입니다. 소중한 시간을 내어 의견을 주셔서 감사드립니다. 담당 부서에 고객님의 의견을 전달하여 이용 편의를 높일 수 있는 방안을 고려하겠습니다. 고객님의 적극적인 참여에 감사드리며, 앞으로도 보다 나은 서비스로 보답하겠습니다.",3.57.0,2024-09-14 08:56:42,before
e4af782c-8858-4848-ac7d-33414f79fd19,쟈바칩,좋습니다 멤버십 구매한 뒤로 정말 잘 사용하고 있습니다 다만 캡처 기능이 사라져서 아쉽네요 눈물납니다,5,0,3.57.0,"안녕하세요. 라프텔입니다. 유감스럽게도 라프텔 모바일 앱에서 제공되는 스크린샷 기능은 애니메이션 저작권자의 공중 송신권, 배포권, 2차적 저작물 작성권 등의 저작권 침해가 발생할 수 있어서 법률적인 이유로 인해 더이상 제공하기 어렵게 되었습니다. 이로 인해 불편을 끼쳐 드려 죄송합니다. 너른 양해 부탁드리겠습니다. 관련 자세한 내용은 공지사항을 참고해 주시기 바랍니다. ▶︎ https://help.laftel.net/hc/ko/articles/9199749896847",3.57.0,2024-09-14 00:16:12,before
fc1f1daa-aa9c-4d52-aeb7-cb9794742302,천세준,굳,5,0,3.56.0,안녕하세요. 라프텔입니다. 고객님께서 만족하셨다니 저희도 기쁘고 보람을 느낍니다. 앞으로도 더 나은 서비스를 제공하기 위해 최선을 다하겠습니다.,3.56.0,2024-09-13 08:53:22,before
3f3a1f63-41d9-4e18-bcc9-d7904e0fa5e7,안진성,좋음,5,0,3.56.0,안녕하세요. 라프텔입니다. 고객님께서 만족하셨다니 저희도 기쁘고 보람을 느낍니다. 앞으로도 더 나은 서비스를 제공하기 위해 최선을 다하겠습니다.,3.56.0,2024-09-13 00:48:19,before
213ddf05-0373-42a7-bfb5-de4b3daa0168,Google 사용자,너무 잘보고 있습니다!!,5,0,3.56.0,안녕하세요. 라프텔입니다. 고객님께서 만족하셨다니 저희도 기쁘고 보람을 느낍니다. 앞으로도 더 나은 서비스를 제공하기 위해 최선을 다하겠습니다.,3.56.0,2024-09-12 00:45:54,before
7e2b3fb3-5dd4-4383-b94c-8d1d201c9d2d,평범이,돈남으면 하세요,5,0,,"안녕하세요. 라프텔입니다. 라프텔 서비스 만족을 드리지 못해 유감입니다. 어떤 부분에서 문제를 느끼셨는지, 어떤 개선점을 기대하셨는지 자세히 알려주시면 감사하겠습니다. 고객님의 의견과 아이디어는 라프텔의 성장과 발전에 큰 도움이 됩니다. 소중한 의견을 토대로 더 나은 서비스로 발전하고자 노력하겠습니다. 고객센터 페이지에서 우측 하단 말풍선 아이콘을 눌러 상담을 요청하실 수 있습니다. ▶︎ 라프텔 고객센터: https://help.laftel.net/hc/ko",,2024-09-12 00:31:56,before
b243d3a2-860d-4669-b990-9acd1792b255,봉봉,굿,4,0,3.29.0,안녕하세요. 라프텔입니다. 고객님께서 만족하셨다니 저희도 기쁘고 보람을 느낍니다. 앞으로도 더 나은 서비스를 제공하기 위해 최선을 다하겠습니다.,3.29.0,2024-09-11 06:14:15,before
409b6619-c62b-4447-8ae5-a6cfc4d4e9c3,창민전,항상 감사합니다,5,0,3.53.0,안녕하세요. 라프텔입니다. 고객님께서 만족하셨다니 저희도 기쁘고 보람을 느낍니다. 앞으로도 더 나은 서비스를 제공하기 위해 최선을 다하겠습니다.,3.53.0,2024-09-11 03:23:11,before
cf6e244f-984e-40d1-a946-a495718808e0,Stone Soon,볼게 많은데 더 많아졌으면,5,0,3.56.0,"안녕하세요. 라프텔입니다. 라프텔은 애니메이션 전문 스트리밍 서비스로써 더 많은 작품을 확보하고, 고객님께서 원하는 콘텐츠를 제공할 수 있도록 지속적으로 노력하고 있습니다. 앞으로도 고객님의 기대에 부응하기 위해 최선을 다하겠습니다. 소중한 의견 주셔서 감사합니다.",3.56.0,2024-09-11 02:34:50,before
c95131da-89ec-400c-b359-558cd0c0a2c7,서경기,요기 죠죠의기묘한모험 하나요?,5,0,,"안녕하세요, 라프텔입니다. -죠죠의 기묘한 모험- 작품 시리즈는 라프텔에서 서비스되고 있습니다. 라프텔에서 검색하여 감상해 보시기 바랍니다. ▶︎ 애니 보러 가기: https://laftel.net",,2024-09-10 19:30:59,before
8a6af7fa-d67a-41bf-9f79-190e99408f71,최정원,"라프텔 1년간 사용했습니다 OTT(넷플릭스, 티빙, 디즈니, 웨이브)도 이용중인데 라프텔만의 매력이... 점점 사라져 갑니다 보고싶은 것들은 판권이 없고 매주 방영되는것들은 OTT도 하는데요 이쯤 되면 무슨 말 하는 지는 아실거라 믿어요",3,0,3.56.0,"안녕하세요. 라프텔입니다. 라프텔은 애니메이션 전문 스트리밍 서비스로써 더 많은 작품을 확보하고, 고객님께서 원하는 콘텐츠를 제공할 수 있도록 지속적으로 노력하고 있습니다. 앞으로도 고객님의 기대에 부응하기 위해 최선을 다하겠습니다. 소중한 의견 주셔서 감사합니다.",3.56.0,2024-09-10 17:32:27,before
52653ae4-1ec4-4b84-a32a-89b23352bd16,CHAN RYU,라프텔 항상고마워요 짱짱,5,0,3.56.0,안녕하세요. 라프텔입니다. 고객님의 소중한 리뷰에 감사드립니다! 라프텔에 만족하셨다니 정말 기쁩니다. 고객님의 만족은 저희에게 큰 힘이 됩니다. 앞으로도 지속적으로 더 나은 서비스를 제공하기 위해 최선을 다하겠습니다.,3.56.0,2024-09-10 15:34:59,before
411c3e99-7ca8-443b-97ce-2c563345404a,레키JK,아주 좋습니다,5,0,3.56.0,안녕하세요. 라프텔입니다. 고객님의 소중한 리뷰에 감사드립니다! 라프텔에 만족하셨다니 정말 기쁩니다. 고객님의 만족은 저희에게 큰 힘이 됩니다. 앞으로도 지속적으로 더 나은 서비스를 제공하기 위해 최선을 다하겠습니다.,3.56.0,2024-09-10 08:21:18,before
3ada85b8-406f-4840-896e-90c01d3900b0,윤재희,솔직히 데스노트 보려고 깔았다. 최고였다. 내 인생의 최고의 애니다. 추천한다. 엘 귀엽다. 우리 엘 많이 사랑해주라. 이상이다.,5,0,3.56.0,안녕하세요. 라프텔입니다. 고객님의 긍정적인 리뷰에 깊이 감사드립니다! 만족스러운 경험을 제공해 드릴 수 있어 매우 기쁩니다. 앞으로도 지속적으로 더 나은 서비스를 제공하기 위해 최선을 다하겠습니다.,3.56.0,2024-09-09 23:16:51,before
475f194b-d157-48e8-ac2c-845f02eb826e,이재준,그렇게 살지마라 유튜브 채널 삭제나 하고 ㅉㅉ,1,0,,,,2024-09-09 22:42:57,before
0084ee64-4f68-40cd-90d6-cb57b20fdf1a,ᄋᄋᄋ,죠죠가 어째서 19세제한...... 이해ㅜ불가ㅜ,4,0,3.56.0,"안녕하세요, 라프텔입니다. 라프텔은 국내 판권 계약을 기반으로 콘텐츠를 제공하고 있으며, 모든 콘텐츠는 방송법과 영화 및 비디오물의 진흥에 관한 법률을 준수합니다. 방송통신심의위원회 또는 영상물등급위원회에서 결정한 관람 등급이 매겨지고 심의를 거친 후 제공됩니다. 너그럽게 이해해 주시기 바랍니다.",3.56.0,2024-09-09 12:34:42,before
875bda3a-778a-4c4e-a40d-d06b78014ecb,A,이메일로 로그인 하는 방법이 없네요;; 비밀번호 재설정까지 했는데 로그인창이 없고 가입창 밖에 없어서 이용을 못 하고 있어요,1,0,3.56.0,"안녕하세요, 라프텔입니다. 하단 [MY]를 탭하고, 상단 [로그인/가입]을 선택하고, 회원 가입했던 방식으로 라프텔에 로그인하시면 됩니다. 로그인 과정에서 어려움을 겪고 계신가요? 문제 해결을 위해 이용 중인 라프텔 계정(이메일 주소)와 함께 문제 상황을 스크린샷으로 캡처하여 고객센터에 상세히 알려주시기 바랍니다. 고객센터 페이지에서 우측 하단 말풍선 아이콘을 눌러 상담을 요청하실 수 있습니다. ▶︎ 라프텔 고객센터: https://help.laftel.net/hc/ko",3.56.0,2024-09-08 21:05:37,before
bdeb62fd-8529-4993-9a33-e4a8cb328212,ᄋᄋᄋ,진짜 너무 잘 사용하고 있는 유저입니다 다만 보면서 아쉬웠던 점은 예전에 있던 캡쳐기능이 사라진 것과 그리고 원하는 애니가 없을 때 말할 수 있는 기능 같은 게 있었으면 좋겠습니다😢😢진짜 두 기능만 생긴다면 진짜 훨씬 행복하게 볼 거 같습니다,5,8,3.56.0,"안녕하세요. 라프텔입니다. 유감스럽게도 라프텔 모바일 앱에서 제공되는 스크린샷 기능은 애니메이션 저작권자의 공중 송신권, 배포권, 2차적 저작물 작성권 등의 저작권 침해가 발생할 수 있어서 법률적인 이유로 인해 더이상 제공하기 어렵게 되었습니다. 이로 인해 불편을 끼쳐 드려 죄송합니다. 너른 양해 부탁드리겠습니다. 관련 자세한 내용은 공지사항을 참고해 주시기 바랍니다. ▶︎ https://help.laftel.net/hc/ko/articles/9199749896847",3.56.0,2024-09-08 18:31:25,before
5fac4fd1-8d5f-4708-ae34-9f6350e2c437,메린,앱 잘 사용하고 있는데요 다음화로 넘어가려고 할 때마다 갑자기 연결할 수 없다고 나오는 일이 많아서 이용하는데 불편합니다..,5,0,3.56.0,"안녕하세요. 라프텔입니다. 번거로우시겠지만 사용 중인 기기에서 라프텔 앱을 삭제한 후 최신 버전으로 다시 설치하여 문제가 해결되었는지 확인해 보실 수 있을까요? 그런데도 이슈가 계속된다면, 기기 모델명과 OS 버전 정보와 함께 문제 상황을 찍은 스크린샷을 고객센터로 알려 주시기 바랍니다. 고객센터 페이지에서 우측 하단 말풍선 아이콘을 눌러 상담을 요청하실 수 있습니다. ▶︎ 라프텔 고객센터: https://help.laftel.net/hc/ko",3.56.0,2024-09-08 17:38:42,before
568e7f2a-e627-4d5a-a4b2-a0a9ed6ec066,박기영,좋아요,5,0,3.56.0,안녕하세요. 라프텔입니다. 고객님께서 만족하셨다니 저희도 기쁘고 보람을 느낍니다. 앞으로도 더 나은 서비스를 제공하기 위해 최선을 다하겠습니다.,3.56.0,2024-09-08 11:30:48,before
945e8f6e-f04a-4a6e-bdbb-6772d6d02d61,김미주,잘보고있 습니다,5,0,3.37.0,안녕하세요. 라프텔입니다. 고객님의 긍정적인 리뷰에 깊이 감사드립니다! 만족스러운 경험을 제공해 드릴 수 있어 매우 기쁩니다. 앞으로도 지속적으로 더 나은 서비스를 제공하기 위해 최선을 다하겠습니다.,3.37.0,2024-09-08 10:48:39,before
9c0e0069-164c-4c50-8d35-84c8743586d4,나다!,장점:보고 싶은게 있으면 있음 단점:보고 싶은게 있으면 없음 장난이고 잘 이용하고 있음:),5,0,3.56.0,안녕하세요. 라프텔입니다. 고객님께서 만족하셨다니 저희도 기쁘고 보람을 느낍니다. 앞으로도 더 나은 서비스를 제공하기 위해 최선을 다하겠습니다.,3.56.0,2024-09-08 08:37:41,before
e6e36e94-c8db-449c-876f-6a66a173d316,RhythmAction,네좋아요,5,0,,안녕하세요. 라프텔입니다. 고객님께서 만족하셨다니 저희도 기쁘고 보람을 느낍니다. 앞으로도 더 나은 서비스를 제공하기 위해 최선을 다하겠습니다.,,2024-09-08 07:03:32,before
8fad4052-51c1-4339-a299-257634581785,이민희,편리하게 만화나 영화를 볼수있어서 좋아요!,4,0,3.56.0,안녕하세요. 라프텔입니다. 고객님의 긍정적인 리뷰에 깊이 감사드립니다! 만족스러운 경험을 제공해 드릴 수 있어 매우 기쁩니다. 앞으로도 지속적으로 더 나은 서비스를 제공하기 위해 최선을 다하겠습니다.,3.56.0,2024-09-07 22:57:03,before
5909d47f-803e-45e3-b55d-780edd154209,김원복,굿!!!,5,0,3.56.0,안녕하세요. 라프텔입니다. 고객님께서 만족하셨다니 저희도 기쁘고 보람을 느낍니다. 앞으로도 더 나은 서비스를 제공하기 위해 최선을 다하겠습니다.,3.56.0,2024-09-07 21:57:14,before
