reviewId,userName,content,score,thumbsUpCount,reviewCreatedVersion,replyContent,appVersion,date,avod_end
75a4a901-baab-4626-8f04-0dcd2b42e8fe,뿡쓰,잘보고있습니다,5,0,3.52.0,안녕하세요. 라프텔입니다. 고객님의 소중한 리뷰에 감사드립니다! 라프텔에 만족하셨다니 정말 기쁩니다. 고객님의 만족은 저희에게 큰 힘이 됩니다. 앞으로도 지속적으로 더 나은 서비스를 제공하기 위해 최선을 다하겠습니다.,3.52.0,2024-04-28 22:42:48,before
6ebec9c1-a91d-4137-8094-3302267f306e,동진,디운로드 한 작품은 기다려도 재생이 안되네요..;;;;;,1,0,3.52.0,"안녕하세요. 라프텔입니다. 라프텔은 인터넷 기반 스트리밍 서비스이므로 이용하는 네트워크 환경에 따라 원활한 다운로드가 어려울 수 있습니다. 케이블, 라우터, 방화벽, VPN 등 네트워크 환경을 점검하고 인터넷 재연결하여 다시 다운로드해 보시기 바랍니다. 그런데도 이슈가 계속된다면, 기기 모델명과 OS 버전 정보와 함께 문제 상황을 기록한 스크린 레코딩을 고객센터로 알려 주시기 바랍니다. 고객센터 페이지에서 우측 말풍선 아이콘을 눌러 상담을 요청하실 수 있습니다. ▶︎ 라프텔 고객센터: https://help.laftel.net/hc/ko",3.52.0,2024-04-28 21:12:27,before
562e69b2-3edf-4921-a797-0eaac0749963,박똥똥이요정,갑자기 분분미션이 안돼요.,4,1,3.52.0,"안녕하세요. 라프텔입니다. 번거로우시겠지만 사용 중인 기기에서 라프텔 앱을 삭제한 후 최신 버전으로 다시 설치하여 문제가 해결되었는지 확인해 주시기 바랍니다. 그런데도 이슈가 계속된다면, 기기 모델명과 OS 버전 정보와 함께 문제 상황을 기록한 스크린 레코딩을 고객센터로 알려 주시기 바랍니다. 고객센터 페이지에서 우측 말풍선 아이콘을 눌러 상담을 요청하실 수 있습니다. ▶︎ 라프텔 고객센터: https://help.laftel.net/hc/ko",3.52.0,2024-04-28 16:43:22,before
32e55219-f129-4fcb-84aa-ec895d6aaf91,Twinkle Star,라프텔에서 애니를 크롬캐스트로 연결해서 애니를 시청해왔습니다. 오랫동안 쓰면서 문제 없었는데 최근 며칠 전 부터 크롬캐스트에 연결하면 TV에 영상은 재생이 되는데 라프텔 앱이 중단되는 증상이 발생했습니다. 여러 조치를 다 해도 안되서 휴대전화를 공장초기화까지 했는데 같은 증상이 반복됩니다. 전화 상담은 아예 되지도 않고 홈페이지에 상담톡 보냈는데도 며칠째 답변이 없습니다. 내가 한 달에 1만원씩이나 결제하는데 돈은 돈대로 낭비되고 마음대로 이용도 안되서 너무 화가 납니다. 고객응대가 안되서 더 화가 나네요. 제발 좀 도와주세요.,1,2,3.52.0,"안녕하세요. 라프텔입니다. 저희는 콜센터를 운영하지 않아 전화 상담이 어려운 점 양해 바랍니다. 이용 불편을 드려 죄송합니다. 다음 개선에서 반영될 수 있도록 담당 부서에 문제 해결을 요청하였습니다. 다만, 수정까지는 시일이 소요될 수 있는 점 참고 부탁드립니다. 이용 중 궁금한 사항이 있거나 도움이 필요하시다면, 언제든지 고객센터로 연락주시기 바랍니다. 고객센터 페이지에서 우측 말풍선 아이콘을 눌러 상담을 요청하실 수 있습니다. ▶︎ 라프텔 고객센터: https://help.laftel.net/hc/ko
",3.52.0,2024-04-28 15:19:56,before
37fd1329-73a7-447e-aa96-473e7fd5ccf5,이이,평소 분분 시스템을 사용했었는데 갑자기 오늘부터 분분 시스템 사용을 위해 버튼을 누르면 앱 밖으로 나가집니다ㅜㅜ 오류 고쳐주세요!,4,3,3.52.0,"안녕하세요. 라프텔입니다. 번거로우시겠지만 사용 중인 기기에서 라프텔 앱을 삭제한 후 최신 버전으로 다시 설치하여 문제가 해결되었는지 확인해 주시기 바랍니다. 그런데도 이슈가 계속된다면, 기기 모델명과 OS 버전 정보와 함께 문제 상황을 기록한 스크린 레코딩을 고객센터로 알려 주시기 바랍니다. 고객센터 페이지에서 우측 말풍선 아이콘을 눌러 상담을 요청하실 수 있습니다. ▶︎ 라프텔 고객센터: https://help.laftel.net/hc/ko",3.52.0,2024-04-27 22:12:55,before
05d3bc90-296b-4f09-a3ca-5b8fc3a180f5,박찬수,전체화면 버그좀 빨리 고쳐주세요. 너무 불편함,4,1,3.52.0,"안녕하세요. 라프텔입니다. 번거로우시겠지만 사용 중인 기기에서 라프텔 앱을 삭제한 후 최신 버전으로 다시 설치하여 문제가 해결되었는지 확인해 주시기 바랍니다. 그런데도 이슈가 계속된다면, 기기 모델명과 OS 버전 정보와 함께 문제 상황을 기록한 스크린 레코딩을 고객센터로 알려 주시기 바랍니다. 고객센터 페이지에서 우측 말풍선 아이콘을 눌러 상담을 요청하실 수 있습니다. ▶︎ 라프텔 고객센터: https://help.laftel.net/hc/ko",3.52.0,2024-04-27 22:11:48,before
e7b7cd66-d30c-4bec-95db-df26138aaccf,Black Kneeger,Subarashi,5,0,,안녕하세요. 라프텔입니다. 고객님의 긍정적인 리뷰에 깊이 감사드립니다! 만족스러운 경험을 제공해 드릴 수 있어 매우 기쁩니다. 앞으로도 지속적으로 더 나은 서비스를 제공하기 위해 최선을 다하겠습니다.,,2024-04-27 17:10:53,before
e134a87d-d53b-40fb-8733-6e0e75601a40,현쨩,구글홈으로 연결하면 TV화면은 나오는데 어플이 강제종료됩니다ㅠ 해결부탁드려요,3,0,3.52.0,"안녕하세요. 라프텔입니다. 번거로우시겠지만 사용 중인 기기에서 라프텔 앱을 삭제한 후 최신 버전으로 다시 설치하여 문제가 해결되었는지 확인해 주시기 바랍니다. 그런데도 이슈가 계속된다면, 기기 모델명과 OS 버전 정보와 함께 문제 상황을 기록한 스크린 레코딩을 고객센터로 알려 주시기 바랍니다. 고객센터 페이지에서 우측 말풍선 아이콘을 눌러 상담을 요청하실 수 있습니다. ▶︎ 라프텔 고객센터: https://help.laftel.net/hc/ko",3.52.0,2024-04-27 16:42:48,before
711b1b0e-5fc2-43a7-8f40-a83b01ae81de,박지환,굿,5,0,3.52.0,안녕하세요. 라프텔입니다. 고객님의 긍정적인 리뷰에 깊이 감사드립니다! 만족스러운 경험을 제공해 드릴 수 있어 매우 기쁩니다. 앞으로도 지속적으로 더 나은 서비스를 제공하기 위해 최선을 다하겠습니다.,3.52.0,2024-04-27 14:43:52,before
7678a3d0-7547-466a-b763-ff01a935af59,윤민수,너무 좋아요,5,0,3.52.0,안녕하세요. 라프텔입니다. 고객님의 긍정적인 리뷰에 깊이 감사드립니다! 만족스러운 경험을 제공해 드릴 수 있어 매우 기쁩니다. 앞으로도 지속적으로 더 나은 서비스를 제공하기 위해 최선을 다하겠습니다.,3.52.0,2024-04-27 14:43:13,before
99fe577a-4cec-4fff-8842-845c55b096c0,우동완,잘쓰고있어여,5,0,3.52.0,안녕하세요. 라프텔입니다. 고객님의 긍정적인 리뷰에 깊이 감사드립니다! 만족스러운 경험을 제공해 드릴 수 있어 매우 기쁩니다. 앞으로도 지속적으로 더 나은 서비스를 제공하기 위해 최선을 다하겠습니다.,3.52.0,2024-04-26 22:37:52,before
980435e1-7612-4d74-8e8a-8e51fab9efee,사슴,요즘 들어오는 애니들도 많고 좋아요👍,5,0,3.51.0,안녕하세요. 라프텔입니다. 고객님의 칭찬에 깊이 감사드립니다! 라프텔을 즐겁게 이용하셨다니 저희도 매우 기쁩니다. 고객님의 격려는 저희가 더 나은 서비스를 제공하는 데 큰 원동력이 됩니다. 앞으로도 최고의 경험을 제공하기 위해 노력하겠습니다.,3.51.0,2024-04-26 18:21:23,before
09e61fad-58fd-4372-b5e6-0021d9ace384,스티치,광고만 조금 줄였으면 좋겠다!,5,0,3.51.0,"안녕하세요. 라프텔입니다. 국내 공식 애니 수입사들과 합법적인 계약을 통해 국내 최대 애니작품을 서비스하고 있습니다. 멤버십을 이용하시면 멤버십에 포함된 작품을 광고 없이 무제한 감상할 수 있습니다. 멤버십을 이용하지 않더라도 '광고 보고 무료 보기' 통해 이용하여 중간 광고를 시청하면 무료로 작품을 감상할 수 있습니다. 영상 상세 페이지에 [광고 무료] 아이콘이 표시된 작품들은 광고 시청 후 무료 감상 가능합니다. 또한, '분분'을 통해 특정 미션을 수행하여 멤버십 작품 무료 감상 시간을 받을 수 있습니다. 무료로 감상 서비스를 제공하기 위해 콘텐츠 수입사와 협의하여 광고 시스템으로 제공하는 점 참고 부탁드립니다.",3.51.0,2024-04-25 22:50:51,before
38754b22-d6a3-48eb-9c20-dd2c106455c1,김수정,애니를보는앱이있어서좋아요,5,0,3.51.0,안녕하세요. 라프텔입니다. 고객님의 긍정적인 리뷰에 깊이 감사드립니다! 만족스러운 경험을 제공해 드릴 수 있어 매우 기쁩니다. 앞으로도 지속적으로 더 나은 서비스를 제공하기 위해 최선을 다하겠습니다.,3.51.0,2024-04-25 18:15:06,before
1711dc39-ee2f-48ac-97be-86e6ac788539,Raeyeop Jeong,"제발 PIP 오류 좀 고쳐주세요. 버그 발생 경위도 모르겠고, PIP로 보다가 확장해서 보면 화면 작아져서 어플 끄고 다시 보는게 너무 힘들어요.",4,0,3.51.0,"안녕하세요. 라프텔입니다. 번거로우시겠지만 사용 중인 기기에서 라프텔 앱을 삭제한 후 최신 버전으로 다시 설치하여 문제가 해결되었는지 확인해 주시기 바랍니다. 그런데도 이슈가 계속된다면, 기기 모델명과 OS 버전 정보와 함께 문제 상황을 기록한 스크린 레코딩을 고객센터로 알려 주시기 바랍니다. 고객센터 페이지에서 우측 말풍선 아이콘을 눌러 상담을 요청하실 수 있습니다. ▶︎ 라프텔 고객센터: https://help.laftel.net/hc/ko",3.51.0,2024-04-25 01:59:02,before
a37fc2a4-346e-49c1-9324-9c366824caf7,Hyelim Seo,재미있어요,5,0,3.51.0,안녕하세요. 라프텔입니다. 고객님의 긍정적인 리뷰에 깊이 감사드립니다! 만족스러운 경험을 제공해 드릴 수 있어 매우 기쁩니다. 앞으로도 지속적으로 더 나은 서비스를 제공하기 위해 최선을 다하겠습니다.,3.51.0,2024-04-24 19:55:02,before
888598b5-b5e6-441e-91fd-2c97329b78f4,수야,굳,5,0,3.51.0,안녕하세요. 라프텔입니다. 고객님의 긍정적인 리뷰에 깊이 감사드립니다! 만족스러운 경험을 제공해 드릴 수 있어 매우 기쁩니다. 앞으로도 지속적으로 더 나은 서비스를 제공하기 위해 최선을 다하겠습니다.,3.51.0,2024-04-24 17:59:16,before
cbab08f8-3476-403f-afa7-4c7c8c9ea7fe,임지수,라프텔 비밀번호 변경할 때 비밀번호 찾기도 있으면 좋겠어요 변경하려고 하는데 사용했던 비밀번호를 못 찾아서 포기했거든요.,3,0,3.51.0,"안녕하세요. 라프텔입니다. 비밀번호 재설정 기능을 제공하고 있습니다. 비밀번호를 잊으신 경우, '비밀번호 재설정'를 이용해 주세요. 가입하신 이메일 주소로 비밀번호를 설정할 수 있는 메일이 발송됩니다. 수신 메일에 있는 링크를 통해 비밀번호를 설정해 주세요. ▶︎ 비밀번호 재설정하러 가기: https://laftel.net/auth/find-password/
",3.51.0,2024-04-24 15:55:19,before
337739a3-778c-49d1-a93f-3998561bdff4,열무와춘장이,진심 볼거없음...,1,1,3.51.0,"안녕하세요. 라프텔입니다. 보고 싶은 작품이 라프텔에서 서비스되지 않아 유감입니다. 현재 라프텔은 국내에 판권이 있는 대부분의 작품을 서비스하고 있습니다. 보고 싶은 작품이 서비스되지 않는 경우, 국내에 판권이 없거나 복잡한 판권 문제일 가능성이 큽니다. 보고 싶은 작품에 ‘요청하기’ 혹은 ‘보고싶다’를 눌러 주시면, 해당 작품이 라프텔에 업데이트될 때 바로 알림을 받으실 수 있습니다. 언제나 라프텔을 사랑해 주셔서 감사합니다.",3.51.0,2024-04-23 03:56:05,before
450958a9-520f-4103-b99c-97172f03c222,몰똥남편,👍,5,0,3.51.0,안녕하세요. 라프텔입니다. 고객님의 긍정적인 리뷰에 깊이 감사드립니다! 만족스러운 경험을 제공해 드릴 수 있어 매우 기쁩니다. 앞으로도 지속적으로 더 나은 서비스를 제공하기 위해 최선을 다하겠습니다.,3.51.0,2024-04-22 19:08:43,before
d96b456d-4c56-4892-b692-66e92f7c73a1,종,제발 앱내 버그좀 고쳐주십쇼.. 도대체 몇년째 방치하는겁니까? 피드백 들어오지않나요? 이게 구독형 OTT 어플 맞나요?,3,0,3.51.0,"안녕하세요. 라프텔입니다. 이용 불편을 드려 죄송합니다. 어떤 부분에서 문제를 느끼셨는지, 어떤 개선점을 기대하셨는지 자세히 알려주시면 감사하겠습니다. 고객센터 페이지에서 우측 말풍선 아이콘을 눌러 언제든지 문의사항이나 의견을 보낼 수 있습니다. ▶︎ 라프텔 고객센터: https://help.laftel.net/hc/ko",3.51.0,2024-04-22 14:21:29,before
d78d6e6b-1c87-47ec-9dff-1ab64e297d0f,모라노,너무 좋은데요 아쉬운 점이 있다면 일괄 다운로드 기능이 없어서 일일이 하나하나 다운 받아야 한다는 점이 많이 불편하네요,4,0,3.51.0,"안녕하세요. 라프텔입니다. 소중한 시간을 내어 의견을 주셔서 감사드립니다. 아쉽게도 현재로서는 해당 기능을 제공하고 있지 않습니다. 담당 부서에 고객님의 의견을 전달하여 이용 편의를 높일 수 있는 방안을 고려하겠습니다. 고객님의 적극적인 참여에 감사드리며, 앞으로도 보다 나은 서비스로 보답하겠습니다.",3.51.0,2024-04-22 09:26:59,before
1eab36b5-ae36-465e-a10f-b8dc2ac1cdb3,겨울령,그냥 좋아,5,0,3.51.0,안녕하세요. 라프텔입니다. 고객님의 긍정적인 리뷰에 깊이 감사드립니다! 만족스러운 경험을 제공해 드릴 수 있어 매우 기쁩니다. 앞으로도 지속적으로 더 나은 서비스를 제공하기 위해 최선을 다하겠습니다.,3.51.0,2024-04-22 00:24:36,before
a98ab9cc-6767-44ef-a410-442558cbcedf,윤건호,만족합니다! 다 좋아요,5,0,3.51.0,안녕하세요. 라프텔입니다. 고객님의 긍정적인 리뷰에 깊이 감사드립니다! 만족스러운 경험을 제공해 드릴 수 있어 매우 기쁩니다. 앞으로도 지속적으로 더 나은 서비스를 제공하기 위해 최선을 다하겠습니다.,3.51.0,2024-04-22 00:13:48,before
1c61a9b4-eaef-44c7-b27f-9258af0acf9c,순청,굿,5,0,3.51.0,안녕하세요. 라프텔입니다. 고객님의 긍정적인 리뷰에 깊이 감사드립니다! 만족스러운 경험을 제공해 드릴 수 있어 매우 기쁩니다. 앞으로도 지속적으로 더 나은 서비스를 제공하기 위해 최선을 다하겠습니다.,3.51.0,2024-04-21 20:07:28,before
0f6ce700-f0eb-4a6f-a16f-9de47985f6f1,김무늬,👍,5,0,,안녕하세요. 라프텔입니다. 고객님의 긍정적인 리뷰에 깊이 감사드립니다! 만족스러운 경험을 제공해 드릴 수 있어 매우 기쁩니다. 앞으로도 지속적으로 더 나은 서비스를 제공하기 위해 최선을 다하겠습니다.,,2024-04-21 17:53:29,before
73481cf8-d473-46af-9bc8-075423911962,키리하라카즈토,잘보고있어요,5,0,3.51.0,안녕하세요. 라프텔입니다. 고객님의 긍정적인 리뷰에 깊이 감사드립니다! 만족스러운 경험을 제공해 드릴 수 있어 매우 기쁩니다. 앞으로도 지속적으로 더 나은 서비스를 제공하기 위해 최선을 다하겠습니다.,3.51.0,2024-04-21 14:51:20,before
30027dcf-83cb-4e67-91a8-b3d13f6d470a,파스타,"라프텔을 완전히 종료하지 않고 전원버튼을 누를시에 10여분간 스크롤바및 기본기능외에 휴대전화의 모든기능이 정지되는 오류가 잦습니다, 최신기종의 새로산 휴대전화임에도 불구하고 지속적인 끊김으로 기기의 속도도 점점 느려지고 있습니다, 또 시청중인 콘텐츠의 전체화면에서 되돌릴때 회면이 오른쪽으로 이동해 절반가량이 가려진 모습으로 보입니다.",1,10,3.51.0,"안녕하세요. 라프텔입니다. 번거로우시겠지만 사용 중인 기기에서 라프텔 앱을 삭제한 후 최신 버전으로 다시 설치하여 문제가 해결되었는지 확인해 주시기 바랍니다. 그런데도 이슈가 계속된다면, 기기 모델명과 OS 버전 정보와 함께 문제 상황을 기록한 스크린 레코딩을 고객센터로 알려 주시기 바랍니다. 고객센터 페이지에서 우측 말풍선 아이콘을 눌러 상담을 요청하실 수 있습니다. ▶︎ 라프텔 고객센터: https://help.laftel.net/hc/ko",3.51.0,2024-04-21 14:17:54,before
c799034c-bba6-4625-83da-80e5e080176b,최종권,S7+ 이용자 입니다 전체화면을 해도 영상은 하기 전 사이즈로 나오면서 나머지 화면은 검은색으로 가득 차며 팝업모드 사용하다 다시 전체화면으로 시청하면 네비게이션 바가 안사라져서 화면을 가리는 버그가 있습니다.,4,0,3.51.0,"안녕하세요. 라프텔입니다. 번거로우시겠지만 사용 중인 기기에서 라프텔 앱을 삭제한 후 최신 버전으로 다시 설치하여 문제가 해결되었는지 확인해 주시기 바랍니다. 그런데도 이슈가 계속된다면, 기기 모델명과 OS 버전 정보와 함께 문제 상황을 기록한 스크린 레코딩을 고객센터로 알려 주시기 바랍니다. 고객센터 페이지에서 우측 말풍선 아이콘을 눌러 상담을 요청하실 수 있습니다. ▶︎ 라프텔 고객센터: https://help.laftel.net/hc/ko",3.51.0,2024-04-21 12:15:36,before
78d7faab-94f0-4ad6-8bb2-c860303e9211,정도현,애니를 좋아한다면 여기는 천국,5,0,3.51.0,안녕하세요. 라프텔입니다. 고객님의 칭찬에 깊이 감사드립니다! 라프텔을 즐겁게 이용하셨다니 저희도 매우 기쁩니다. 고객님의 격려는 저희가 더 나은 서비스를 제공하는 데 큰 원동력이 됩니다. 앞으로도 최고의 경험을 제공하기 위해 노력하겠습니다.,3.51.0,2024-04-21 03:59:40,before
f1cb5107-8f9d-4105-833f-03a5404c2b76,우무희,굿,5,0,3.51.0,안녕하세요. 라프텔입니다. 고객님의 긍정적인 리뷰에 깊이 감사드립니다! 만족스러운 경험을 제공해 드릴 수 있어 매우 기쁩니다. 앞으로도 지속적으로 더 나은 서비스를 제공하기 위해 최선을 다하겠습니다.,3.51.0,2024-04-20 19:20:34,before
72534096-62db-4153-8f6b-2d2817d9e86f,채준호,잘보고있음,5,0,3.51.0,안녕하세요. 라프텔입니다. 고객님의 긍정적인 리뷰에 깊이 감사드립니다! 만족스러운 경험을 제공해 드릴 수 있어 매우 기쁩니다. 앞으로도 지속적으로 더 나은 서비스를 제공하기 위해 최선을 다하겠습니다.,3.51.0,2024-04-20 18:13:10,before
34bfd569-2fa3-4960-88b5-f720054a7fd9,오수,4인으로 해서 진짜너무 잘 보고있습니다. 근데 오프닝이나 엔딩 ost에 자막좀 추가해주시면 좋겠어요ㅠㅠ 가끔씩 간단한 유머도 자막이 없을때가 있는.. 무튼 ost만 자막넣어주시면 진짜 좋겠어요. 타 사이트에 비해 가장 패치가 안돼있는 것 같아서 아쉽습니다,4,1,3.51.0,안녕하세요. 라프텔에서 서비스하는 애니메이션은 해당 작품의 권리를 가진 국내 콘텐츠 제공사에서 전달해 주시는 영상을 그대로 사용하기 때문에 저희가 직접 수정하기 어려운 한계가 있는 점 양해 부탁드립니다. 자막의 완성도가 부족하다고 느끼시는 작품에 대해서는 고객센터를 통해 상세히 알려주시면 감사하겠습니다. 이를 콘텐츠 제공사에 전달하여 수정 요청하겠습니다. 고객센터 페이지에서 우측 말풍선 아이콘을 눌러 언제든지 문의사항이나 의견을 보낼 수 있습니다. ▶︎ 라프텔 고객센터: https://help.laftel.net/hc/ko,3.51.0,2024-04-20 03:00:07,before
1146ed81-a1de-498c-b98f-7843c2ee897c,김현정,보고싶은 애니를 검색하고나서 결과가 늦어요,1,0,3.51.0,"안녕하세요. 라프텔입니다. 보고 싶은 작품이 라프텔에서 서비스되지 않아 유감입니다. 현재 라프텔은 국내에 판권이 있는 대부분의 작품을 서비스하고 있습니다. 보고 싶은 작품이 서비스되지 않는 경우, 국내에 판권이 없거나 복잡한 판권 문제일 가능성이 큽니다. 보고 싶은 작품에 ‘요청하기’ 혹은 ‘보고싶다’를 눌러 주시면, 해당 작품이 라프텔에 업데이트될 때 바로 알림을 받으실 수 있습니다. 언제나 라프텔을 사랑해 주셔서 감사합니다.",3.51.0,2024-04-19 20:57:49,before
3f3f2d6d-8499-4262-b82f-48d845ff108e,박만기,굿,5,0,3.51.0,안녕하세요. 라프텔입니다. 고객님의 긍정적인 리뷰에 깊이 감사드립니다! 만족스러운 경험을 제공해 드릴 수 있어 매우 기쁩니다. 앞으로도 지속적으로 더 나은 서비스를 제공하기 위해 최선을 다하겠습니다.,3.51.0,2024-04-19 00:19:58,before
f16514b8-573c-4563-8525-ed0944408e4e,아가하마(baby hippo),앱 자체는 좋음 근데 24년 2분기 애니중 수입되는게 적어도 너~~~~무 적어요. 본인들이 제일 잘 알거라고 생각합니다.,2,1,3.51.0,"안녕하세요. 라프텔입니다. 라프텔은 애니메이션 전문 스트리밍 서비스로써 더 많은 작품을 확보하고, 고객님께서 원하는 콘텐츠를 제공할 수 있도록 지속적으로 노력하고 있습니다. 앞으로도 고객님의 기대에 부응하기 위해 최선을 다하겠습니다!",3.51.0,2024-04-18 23:18:58,before
504f85cd-53bc-4449-9db6-3e31bc508c7b,유월,오프라인 저장 했잖아 왜 재생을 못하니 홈버튼 눌러서 작은 화면으로 볼거라고 왜 화면을 다 보여주질 못하니 왜 일괄 다운로드를 못하니,1,0,3.51.0,"안녕하세요. 라프텔입니다. 번거로우시겠지만 사용 중인 기기에서 라프텔 앱을 삭제한 후 최신 버전으로 다시 설치하여 문제가 해결되었는지 확인해 주시기 바랍니다. 그런데도 이슈가 계속된다면, 기기 모델명과 OS 버전 정보와 함께 문제 상황을 기록한 스크린 레코딩을 고객센터로 알려 주시기 바랍니다. 고객센터 페이지에서 우측 말풍선 아이콘을 눌러 상담을 요청하실 수 있습니다. ▶︎ 라프텔 고객센터: https://help.laftel.net/hc/ko",3.51.0,2024-04-18 20:15:43,before
0416b6ec-414a-4929-a73f-61b1273bb954,bh kim,그냥,1,0,3.51.0,"안녕하세요. 라프텔입니다. 어떤 부분에서 문제를 느끼셨는지, 어떤 개선점을 기대하셨는지 자세히 알려주시면 감사하겠습니다. 고객님의 의견과 아이디어는 라프텔의 성장과 발전에 큰 도움이 됩니다. 소중한 의견을 토대로 더 나은 서비스로 발전하고자 노력하겠습니다. 고객센터 페이지에서 우측 말풍선 아이콘을 눌러 언제든지 문의사항이나 의견을 보낼 수 있습니다. ▶︎ 라프텔 고객센터: https://help.laftel.net/hc/ko",3.51.0,2024-04-18 19:45:16,before
1dea4ca5-3157-4c3c-967a-d02dc24284ce,joyce kim,원하는 작품 잘 들여와주고.. 내 마음 잘 알아주는 라프텔... 없으면 이제 못 삼,5,0,3.51.0,안녕하세요. 라프텔입니다. 고객님의 칭찬에 깊이 감사드립니다! 라프텔을 즐겁게 이용하셨다니 저희도 매우 기쁩니다. 고객님의 격려는 저희가 더 나은 서비스를 제공하는 데 큰 원동력이 됩니다. 앞으로도 최고의 경험을 제공하기 위해 노력하겠습니다.,3.51.0,2024-04-18 18:04:45,before
37d36ea4-332f-4f6f-b831-09beb3ca210e,ways Al,간혹 없는 애니도 있긴한데 그래도 뭐 대체로 나쁘진 않음,4,0,3.51.0,"안녕하세요. 라프텔입니다. 보고 싶은 작품이 라프텔에서 서비스되지 않아 유감입니다. 현재 라프텔은 국내에 판권이 있는 대부분의 작품을 서비스하고 있습니다. 보고 싶은 작품이 서비스되지 않는 경우, 국내에 판권이 없거나 복잡한 판권 문제일 가능성이 큽니다. 보고 싶은 작품에 ‘요청하기’ 혹은 ‘보고싶다’를 눌러 주시면, 해당 작품이 라프텔에 업데이트될 때 바로 알림을 받으실 수 있습니다. 언제나 라프텔을 사랑해 주셔서 감사합니다.",3.51.0,2024-04-18 17:09:49,before
98cc2e6f-498a-49ae-91b6-c708bd7f0206,CJM,"오프라인 저장할때 일괄적으로 다운하는 기능, 저장된 애니를 일괄적으로 삭제하는 기능, 그리고 만료된 오프라인 다운 애니를 일괄적으로 연장하는 기능이 있었으면 좋겠습니다.",5,15,3.51.0,"안녕하세요. 라프텔입니다. 소중한 시간을 내어 의견을 주셔서 감사드립니다. 담당 부서에 고객님의 의견을 전달하여 이용 편의를 높일 수 있는 방안을 고려하겠습니다. 고객님의 적극적인 참여에 감사드리며, 앞으로도 보다 나은 서비스로 보답하겠습니다.",3.51.0,2024-04-18 01:12:23,before
